1,2,3,4,5,6,7
Ana cadde üzeri Gültepe merkez'de Bina. Dükkân ve 2+1 daire,2,1,Klima,90.0,1.850.000 TL,
Bornova Komple Satılık Bina,3,1,Doğalgaz (Kombi),130.0,8.650.000 TL,
Urla Kalabak'ta Satılık Komple Bina (Daire ve Dükkan),3,1,Doğalgaz (Kombi),300.0,30.000.000 TL,
SIFIR BİNA,4,2,Doğalgaz (Kombi),90.0,13.800.000 TL,
Bornova Çamdibinde Komple Satılık 2 Katlı Bina,2,1,Doğalgaz (Kombi),92.0,4.250.000 TL,
Urla Merkezde Satılık Komple Bina,3,1,Yok,330.0,25.000.000 TL,
GÜNEŞ EMLAK'TAN 4 ADET 2+1 95 m2 LİK DAİRELERDEN OLUŞAN SATILIK,4,1,Yok,120.0,4.850.000 TL,
Konak Levent Mahallesinde Satılık Müstakil Konut,1,1,Soba,70.0,1.050.000 TL,
Tr TİRE GAYRİMENKULDEN 3 KAT TİCARİ İMARLI SATILIK MÜSTAKİL BİNA,3,1,Kalorifer,346.0,7.500.000 TL,
ŞİRİNYER HİPODRUM YANINDA 2.KATLI SIFIR MÜSTAKİL BİNA,2,1,Doğalgaz (Kombi),135.0,6.500.000 TL,
Yapıcıoğlu Satılık Bina,2,1,Yok,100.0,5.000.000 TL,
Satılık ev,2,2,Soba,76.0,640.000 TL,
5 katlı SAHİBİNDEN SATILIK BİNA,5,1,Doğalgaz (Kombi),120.0,9.500.000 TL,
ÇAMDİBİ MAHALLESİNDE SIFIR TADİLATLI KOMPLE SATILIK BİNA,3,1,Doğalgaz (Kombi),250.0,7.000.000 TL,
BAYRAKLI ŞEHİR HASTANESİNE YÜRÜME MESAFESİNDE SATILIK BİNA,6,2,Doğalgaz (Kombi),1.5,95.000.000 TL,
PINARBAŞI BORNOVADA KOMPLE SATILIK MERKEZİ KONUMDA EMSALSİZ BİNA,3,1,Doğalgaz (Kombi),337.0,17.500.000 TL,
Çiğlide Komple Satılık Bina,3,1,Doğalgaz (Kombi),420.0,10.250.000 TL,
ERA NİVA'DAN KONAK GÜRÇEŞME'DE SATILIK 115 M2 KOMPLE BİNA,1,1,Klima,115.0,1.900.000 TL,
BUCA GÖKSU MAH 4 KATLI CADDE ÜSTÜ BİNA SATILIKTIR,4,1,Doğalgaz (Kombi),115.0,7.250.000 TL,
SAN GAYRİMENKUL DEN SATILIK TAŞ BİNA,1,5 +,Klima,180.0,10.000.000 TL,
BABACAN'DAN YAMANLAR'DA SATILIK 2 KATLI ''FIRSAT''MÜSTAKİL BİNA,2,1,Klima,130.0,2.440.000 TL,
8 Yıllık 156 mt 3 katlı bina,3,1,Doğalgaz (Kombi),156.0,8.550.000 TL,
,,,,,,
hastaneye alışveriş merkezine pazar yerine anayola yakın,2,1,Doğalgaz Sobası,336.0,5.300.000 TL,
Tepeköy mh Mükemmel konumda Satılık 365m2 arsa ve binası,2,2,Doğalgaz (Kombi),365.0,7.450.000 TL,
SİZE HUZUR VE RAHATLIK SUNAN BİR GAYRİMENKUL İÇİN DOĞRU ADRES !,7,2,Doğalgaz (Kombi),150.0,55.000.000 TL,
KARADENİZ EMLAK'TAN IRMAK MAH'DE KOMPLE SATILIK 4 KATLI APARTMAN,4,1,Doğalgaz (Kombi),130.0,9.000.000 TL,
Karabağlar'da Merkezi Konumda Satılık 6 Katlı+Otoparklı Bina,6,1,Doğalgaz (Kombi),120.0,22.000.000 TL,
KONAK KOMPLE ACİL SATILIK BİNA 3 EV 1 DÜKKAN,3,1,Soba,200.0,2.500.000 TL,
Coldwell Banker Odak'tan Komple Satılık Bina,3,1,Doğalgaz (Kombi),400.0,12.500.000 TL,
EMLAKMATİKTEN PINARBAŞINDA SATILIK 3 KATLI BİNA VE İŞYERİ,3,1,Doğalgaz (Kombi),170.0,8.700.000 TL,
sahibinden satılık bina,3,1,Doğalgaz (Kombi),297.0,19.000.000 TL,
Karabağlar Bozyaka'da 136 m2 Taban Alanlı Komple Satılık Bina,2,1,Yok,136.0,2.900.000 TL,
ÇELİK YAPIDAN YEŞİLBAĞLARDA KOPLE BİNA 3 DAİRE BİR DÜKAN,4,1,Klima,500.0,9.900.000 TL,
Güzelbahçe Merkez'de Satılık Komple Bina,2,1,Klima,168.0,15.500.000 TL,
KİLİMCİ TEPE YAKINI KOMPLE SATILIK YENİ BİNA,4,2,Doğalgaz (Kombi),130.0,15.600.000 TL,
Bayraklı Alparslan'da Deniz Manzaralı Tadilatlı Satılık Bina,4,1,Yok,400.0,4.750.000 TL,
"Denize 200m yakınlıkta,5+1 Müstakil 210m2 konut,2 mutfak,3 banyo",3,3,Kalorifer,210.0,6.750.000 TL,
Çiğlide Komple Satılık Bina,2,1,Doğalgaz (Kombi),250.0,6.000.000 TL,
BOZKAYA EMLAKTAN SATILIK 5+1 VİLLA SIFIR DENİZE 200 M2,3,1,Doğalgaz (Kombi),120.0,11.500.000 TL,
BAYRAKLI EMEK MAHALLESİNDE KAÇIRILMAYACAK YATIRIM FIRSATI,3,1,Klima,110.0,7.250.000 TL,
ULUKENT'TE MERKEZİ KONUMLU OTURMA RUHSATLI KOMPLE SATILIK BİNA,4,1,Doğalgaz (Kombi),160.0,14.500.000 TL,
izmir yeşilova çamdibi 4 katlı bina satılık,4,1,Klima,100.0,9.000.000 TL,
2 KATLI BAHÇELİ EV,2,1,Yok,100.0,1.300.000 TL,
İZMİR /BORNOVA / MEVLANADA 3 KATLI KOMPLE ACİL SATILIK BİNA,3,1,Klima,120.0,7.500.000 TL,
Sahibinden satılık denize 100m,3,1,Doğalgaz (Kombi),300.0,18.500.000 TL,
Karabağlar Çalıkuşu Mahallesinde Komple Satılık 5 Katlı Bina,5,1,Yok,70.0,4.300.000 TL,
KARABAĞLAR YUNUS EMRE MAHALLESİNDE SATILIK 4 KATLI BİNA,4,1,Doğalgaz (Kombi),84.0,5.000.000 TL,
Gaziemir Aktepe Mah. Kentsel Dönüşümde Komple Satılık Bina,3,2,Yok,173.0,10.000.000 TL,
BUCA LALELİ MAH 5 KATLI SATILIK BİNA ÖZCAN EMLAKTAN 3+1,5,1,Klima,130.0,12.500.000 TL,
KONAK BOĞAZİÇİNDE SATILIK 3 KATLI BİNA ÖZACN EMLAKTAN,3,1,Yok,100.0,1.750.000 TL,
YAMANLAR BARIŞ CAD. BP BENZİNLİK YANI SATILIK FIRSAT BİNA,4,1,Doğalgaz (Kombi),400.0,4.150.000 TL,
Işıl'dan Mızraklı Cadde Dibinde 2 Katlı Müstakil Satılık Bina...,2,1,Yok,60.0,1.500.000 TL,
ARGA'DAN BUCA İNÖNÜ MAH. KOMPLE SATILIK BİNA,5,1,Doğalgaz (Kombi),540.0,9.500.000 TL,
Sahibinden Gaziemir Semt garajı yakını yatırımlık 4 Katlı bina,4,3,Doğalgaz (Kombi),160.0,10.500.000 TL,
URLA MERKEZ 2+1 DAİRE VE İŞ YERİ (BİNA),2,1,Kalorifer,219.0,18.000.000 TL,
PRIME LUXURY - BAYRAKLI MANAVKUYU'DA SATILIK KOMPLE BİNA,5,1,Doğalgaz (Kombi),80.0,14.250.000 TL,
AZİM ÇELİK'TEN MÜSTAKİL AİLE BİNASI TINAZTEPE KAMPÜSE YAKIN,3,1,Doğalgaz (Kombi),390.0,8.000.000 TL,
Gaziemir Aktepe Mah 2 Katlı Satılık Bina,2,1,Yok,134.0,2.450.000 TL,
GOOD İNVEST TEN KEMALPAŞA MERKEZDE SATILIK SIFIR LÜKS BİNA,4,1,Doğalgaz (Kombi),650.0,18.000.000 TL,
3 YILDIZDAN İNKILAP İZBAN YANI CADDE ÜZERİ BİNA AYRI TAPULUDUR,3,1,Doğalgaz (Kombi),118.0,6.000.000 TL,
İzmir Kemalpaşada Satılık 240m² Bina ve 2+1 Daire,2,2,Soba,240.0,7.750.000 TL,
Yeşilyurtta Yatırım Değeri Olan Satılık İki Katlı Teraslı Bina,2,1,Yok,168.0,2.950.000 TL,
Çeşme merkezde Tarihi Bina çok acil !!,2,1,Klima,146.0,14.900.000 TL,
Atatürk Mahallesinde Satılık Komple Bina,3,1,Klima,398.0,13.000.000 TL,
ALAÇATIM GAYRİMENKUL'den Kemalpaşa cad.Satılık 3 İşyeri 2 Daire,2,3,Yok,292.0,75.000.000 TL,
gümüşpala merkez meydan,4,1,Doğalgaz (Kombi),70.0,15.000.000 TL,
ADM'DEN SARNIÇ'TA LOKASYONU HARİKA KOMPLE SATILIK BİNA,2,1,Doğalgaz (Kombi),100.0,7.750.000 TL,
Buca Göksu Mahallesi'nde Cadde Üzeri Komple Satılık Bina,3,1,Doğalgaz (Kombi),177.0,16.500.000 TL,
ARTENEW'DEN EŞREFPAŞA CADDE ARKASI SATILIK KELEPİR BİNA,3,1,Yok,56.0,2.500.000 TL,
BOZYAKA SATILIK 3 KATLI BİNA,3,1,Doğalgaz (Kombi),120.0,5.650.000 TL,
Ali Fuat Erden Mahallesinde 3+1 126m2 Geniş 2 Daireli Bina,2,1,Yok,176.0,2.500.000 TL,
KESİNLİKLE FIRSAT TİCARİ MÜLK,2,1,Doğalgaz (Kombi),160.0,19.900.000 TL,
,,,,,,
Urla Yenikent'de Satılık İşyeri+Villa !,2,1,Yerden Isıtma,200.0,24.250.000 TL,
KONAK MERKEZDE SATILIK 3 KATLI BİNA,3,1,Yok,65.0,3.000.000 TL,
Merkezi Lokasyonda 3 Katlı Satılık Komple Bina,3,1,Doğalgaz (Kombi),300.0,15.900.000 TL,
Buca Zafer Mahallesinde Satılık 4 Katlı Komple Bina,4,1,Soba,300.0,9.870.000 TL,
"Karabağlar sanayide, ana yola 500m mesafede, 3 katlı BİNA",3,1,Yok,160.0,4.500.000 TL,
Alizeden izmir torbalıda iskanı rehabilitasyon kiracılı bina,4,1,Doğalgaz (Kombi),1.5,27.500.000 TL,
acil satılık iki ev iki dükkan köşe bina,2,1,Klima,106.0,4.500.000 TL,
Sahibinden Deniz Manzaralı 4 Katlı Komple Satılık Bina,4,1,Doğalgaz (Kombi),100.0,11.870.000 TL,
SATILIK BİNA,3,1,Klima,122.0,2.200.000 TL,
BAYRAKLI SMYRNA 8 KAT İMARLI BOLGE KOMPLE SATILIK BİNA,3,1,Doğalgaz (Kombi),140.0,8.500.000 TL,
ALAÇATI ÇARŞI İÇERİSİNDE SATILIK EV VE İŞYERİ,2,1,Yok,109.0,25.000.000 TL,
komple satılık 2 katlı 0 dairelerde,2,2,Doğalgaz (Merkezi),132.0,8.600.000 TL,
BÖLGENİN EN DEĞERLİ TİCARİ MÜLKÜ,4,1,Klima,2.4,300.000.000 TL,
Marinaya 300 mt. Otele uygun 240 m2 4 katlı bina,4,1,Klima,240.0,12.500.000 TL,
Menemen Irmak Mahallesi'nde Satılık Komple Bine,3,1,Soba,293.0,3.550.000 TL,
STARTKEY EVKA 3 GAYRİMENKUL FARKIYLA KOMPLE SATILIK BİNA,4,1,Doğalgaz (Kombi),472.0,10.500.000 TL,
Mevlana Mahallesi Merkezi Konumda 3 Kat + Çatı Satılık Bina,3,1,Doğalgaz (Kombi),350.0,5.500.000 TL,
ACİL SATILIK 3 KATLI BİNA,3,1,Doğalgaz (Kombi),183.0,6.900.000 TL,
SATILIK 3 KATLI BİNA,3,1,Yok,104.0,2.600.000 TL,
ÇEŞMEDEN:) ALAÇATI ÇARŞI İÇİNDE ORJİNAL TAŞ BİNA ve ARSASI,2,2,Yok,353.0,65.000.000 TL,
Pınarbaşı Çanakkale Caddesi Satılık Bina,3,1,Yok,350.0,14.000.000 TL,
Konak Çınartepe Mahallesinde Satılık (4) Katlı Bina,4,4,Soba,400.0,2.900.000 TL,
SAHİBİNDEN MÜSTAKİL KUPON TRİPLEKS BAHÇELİ,3,1,Doğalgaz (Kombi),200.0,17.250.000 TL,
ERA NİVA'DAN BUCA İNÖNÜ MAHALLESİNDE SATILIK 3 KATLI BİNA,3,1,Klima,88.0,3.900.000 TL,
Turyap Bornova'dan İnönü Mahallesi'nde Satılık Komple Bina,3,1,Klima,120.0,4.250.000 TL,
Sahibinden satılık dört dönümün içinde iki katlı Taş bina,2,1,Soba,4.0,20.000.000 TL,
Yeni Foça Merkez Satılık Bina Pansiyon,2,5 +,Klima,230.0,37.500.000 TL,
PLAJA 40 METRE FIRSAT SATILIK BİNA,2,1,Yok,465.0,6.500.000 TL,
DOĞANLARDA SATILIK 4 KATLI BİNA,4,1,Doğalgaz (Kombi),289.0,12.000.000 TL,
YEŞILOVADA 2 KATLI SATILIK BİNA,2,1,Yok,150.0,5.950.000 TL,
KENT GAYRİMENKUL'DEN KURTULUŞ MAHALLESİ'NDE KOMPLE SATILIK BİNA,3,2,Doğalgaz (Kombi),261.0,6.850.000 TL,
BAYRAKLI OSMANGAZİ MAHALLESİNDE İKİ KATLI SATILIK MÜSTAKİL BİNA,2,1,Doğalgaz (Kombi),260.0,5.600.000 TL,
ERICA'DAN 8 ADET BALKONLU KORİDORLU 1+1 SATILIK BİNA,3,3,Doğalgaz (Kombi),400.0,14.000.000 TL,
SAN GAYRİMENKUL DEN 3 KATLI BUTIK OTEL YAPIMINA UYGUN BİNA,3,1,Klima,147.0,13.000.000 TL,
KEMERALTININ EN İŞLEK CADDESİNDE OTEL VE DÜKKAN OLAN KOMPLE BİNA,5,3,Klima,500.0,14.245.000 TL,
BUCA FIRAT MAHALLESİNDE ÜÇ KATLI KOMPLE TADİLATLI SATILIK BİNA,3,1,Doğalgaz (Kombi),270.0,6.000.000 TL,
ÇINAR EMLAKTAN ÇAMLIKULE MH. KOMPLE SATILIK BİNA,4,2,Doğalgaz (Kombi),900.0,12.500.000 TL,
HATAY ÜÇYOL ÇAMLARALTI KOLEJİ YANI MÜSTAKİL 4 KATLI DENİZ MAN.,4,1,Doğalgaz (Kombi),130.0,10.750.000 TL,
BİLİCİ den 4 katlı bina (120 m2 Brut Net 110 m2 Her Daire 3+1),4,1,Doğalgaz (Kombi),110.0,6.250.000 TL,
BERGAMA'DA KIZIL AVLU'YA YAKIN SATILIK RESTORASYONLU MÜSTAKİL EV,3,1,Klima,291.0,4.190.000 TL,
BORNOVA EVKA3 PROFESÖRLER SİTESİNDE SATILIK 3 KATLI BAHÇELİ BİNA,3,1,Doğalgaz (Kombi),263.0,23.750.000 TL,
BUCA YENİGÜN'DE İKİ KATLI ALTIN DA İŞ YERİ OLAN SATILIK BİNA,2,1,Yok,145.0,5.590.000 TL,
Çiğli Merkezde 3 katlı Bina,3,1,Soba,105.0,4.200.000 TL,
GÜNEŞ EMLAKTAN MENDERES CD ÜZERİ 338m ARSALI KOMPLE SATILIK BİNA,3,1,Yok,338.0,35.000.000 TL,
İZMİR MERKEZDE RESİDENCELER VE RESMİ KURUMLAR YAKINI KOMPLEBİNA,5,1,Klima,840.0,60.000.000 TL,
Kemalpaşa Atatürk Satılık 4 Katlı Bina 189 m2,4,1,Soba,120.0,2.950.000 TL,
HAYY GAYRİMENKULDEN BORNOVA ÇAMDİBİNDE SATILIK KOMPLE BİNA,3,1,Yok,120.0,2.500.000 TL,
3 YILDIZDAN KOKLUCA MEZARLIĞI KARŞISI CADDE ÜZERİ KOMPLE BİNA,3,1,Yok,90.0,8.000.000 TL,
GEDİZ İŞ BANKASI YAKINI 3 KATLI BİNA,3,1,Yok,121.0,3.500.000 TL,
BORNOVA ATATÜRK MAH. 3DAiRELİ ÇİFT CEPHE DENİZ GÖREN KOMPLE BİNA,3,1,Doğalgaz (Kombi),207.0,6.400.000 TL,
,,,,,,
İzmir Karabağlar Mükemmel Konumlu Satılık Komple Bina 1130 M²,4,1,Klima,907.0,15.000.000 TL,
ARTKEY'DEN ŞEH.HASTANESİNE YAKIN KOMPLE BİNA AKTİF FIRIN 2 DAİRE,3,1,Doğalgaz (Merkezi),450.0,14.500.000 TL,
BoRNoVa ıŞıKKeNT'Te SaTıLıK KoMPLe BiNa 3 CePHe,3,1,Doğalgaz (Kombi),266.0,12.999.999 TL,
GAZİEMİR DE SATILIK GENİŞ KOMPLE BİNA_FIRSAT-ACİL,2,1,Soba,170.0,5.300.000 TL,
BAYRAKLI ADALET MAH.'DE 4 KATLI BİNA SATILIKTIR.,4,1,Klima,95.0,5.900.000 TL,
SAHİBİNDEN SATILIK KOMPLE BİNA,3,1,Klima,112.0,3.000.000 TL,
KAÇIRILMICAK FIRSAT TOPLAMDA 4 DAİRE 44.000 KİRA GETİRİLİ DAİRE,3,2,Doğalgaz (Kombi),75.0,5.800.000 TL,
SADULLAH UÇAR'DAN MURATBEY KORULUKTA SATILIK 2 KATLI FIRSAT BİNA,2,1,Soba,268.0,4.500.000 TL,
MAVİŞEHİR CAHER DUDAYEV BULVARI ÜZERİNDE KIYMETLİ SATILIK BİNA,5,1,Yok,1.0,130.000.000 TL,
Karşıyaka Sahilde Satılık Komple Bina,8,1,Yok,1.17,120.000.000 TL,
UYAR GAYRİMENKUL HACIÖMERLİ(MAVİKÖŞE) SATILIK GENİŞ BAHÇELİ EV,1,1,Doğalgaz (Kombi),90.0,6.000.000 TL,
İZMİR BUCA'DA 4 TAPULU SATILIK KOMPİLE BİNA,4,4,Doğalgaz (Kombi),121.0,6.400.000 TL,
Turyap-Bayraklı Çay Mahallesi Cadde Üzeri Dükkan ve 4 Daire,4,4,Doğalgaz (Kombi),1.0,21.000.000 TL,
İZMİR KONAK GÜLTEPE TE DENİZ MANZARALI 2 BİNA ARSA FİYATINA,2,1,Soba,160.0,1.890.000 TL,
ARTENEW'DEN 245m2 ARSALI 4 KATLI KÖŞE BİNA CADDE ÜZERİ,4,1,Doğalgaz (Kombi),250.0,12.500.000 TL,
ARTENEW'DEN SATILIK 133m2 ARSALI 4 KATLI BİNA,4,1,Doğalgaz (Kombi),135.0,6.500.000 TL,
**KARABAĞLAR YUNUS EMRE MAH. AYRI TAPULU KOMPLE SATILIK BİNA,3,1,Klima,144.0,5.500.000 TL,
İZMİR BERGAMA ATATÜRK BULVARI ÜZERİN DE SATILIK BİNA,5,5 +,Yok,550.0,9.800.000 TL,
Bostanlı nın göbeğinde Satılık Bina,4,1,Doğalgaz (Kombi),350.0,200.000.000 TL,
Bornova Kızılayda 2013 Yapımı 6 Daireli Otoparklı Köşe Bina,3,2,Doğalgaz (Kombi),950.0,24.350.000 TL,
Bornova Koşukavak'ta Satılık Yatırımlık Daire ve Dükkan,1,1,Doğalgaz (Kombi),120.0,4.500.000 TL,
İzmir Çiğli Balatçık Yüksek Kira Getirisine Sahip Komple Bina,4,2,Klima,600.0,14.250.000 TL,
İZMİR BORNOVADA SATILIK BİNA,3,1,Klima,305.0,16.500.000 TL,
KAHRAMANDEREDE SATILIK 773 M2 ARSA İÇİNDE SATILIK VİLLA,3,1,Doğalgaz (Kombi),250.0,42.000.000 TL,
Bornova Naldöken'de 4 Katlı Komple Satılık Bina,4,1,Yok,440.0,5.850.000 TL,
BAYRAKLI ALPARSLAN MAHALLESİNDE SATILIK KOMPLE BİNA,3,1,Yok,307.0,9.500.000 TL,
KEMALPAŞA'DA KOMPLE SATILIK BİNA,3,2,Doğalgaz (Kombi),1.5,25.500.000 TL,
DİZAYN'dan Alaçatı Hacımemiş'te Satılık 3 Kat'lı Dükkan,3,1,Yok,200.0,25.000.000 TL,
İZMİR TORBALI TEPEKÖY MAHALLESİNDE SATLIK 3 KATLI BİNA,3,1,Soba,119.0,1.750.000 TL,
CAMİKEBİR MH 19 MAYIS PARKI YANI 686 M2 ARSA İÇİNDE SATILIK BİNA,3,2,Doğalgaz (Kombi),900.0,29.000.000 TL,
ÇİĞLİ ATAŞEHİR HASTANELER BÖLGESİNDE SATILIK BİNA VE ARSA,4,1,Yok,103.0,12.000.000 TL,
SASALI 3 ADET 3+1 DAİRELİ SATILIK KOMPLE BİNA,3,1,Doğalgaz (Kombi),425.0,8.000.000 TL,
BURAK REİS CADDE ÜSTÜ SATILIK DÜKKAN VE 4 DAİRE KOMPLE BİNA,5,1,Yok,545.0,14.000.000 TL,
YUNUS EMRE MAH. ANADOLU LİSESİ ARKASI 375 M2 2 DAİRE 2 DÜKKAN,3,1,Klima,125.0,4.650.000 TL,
Çeşmede Muhteşem Konumlu & Emsalsiz Satılık Değerli Bina 298 M²,3,3,Klima,290.0,27.000.000 TL,
İZKEY'DEN CADDE ÜZERİ KOMPLE SATILIK 4 KATLI BİNA,4,1,Doğalgaz (Kombi),116.0,6.500.000 TL,
SAHİBİNDEN 5 KATLI MÜSTAKİL,5,1,Doğalgaz (Kombi),130.0,14.900.000 TL,
ZEREK PETROL YAKINI 2 KATLI DOĞALGAZLI KOMPLE SATILIK BİNA,2,1,Doğalgaz (Kombi),112.0,3.650.000 TL,
BAYRAKLI ADALET MH. SATILIK KOMPLE BİNA,3,1,Doğalgaz (Merkezi),107.0,9.150.000 TL,
çamlipinarda satılık 3 katlı müstakil bina,3,1,Doğalgaz (Kombi),150.0,5.000.000 TL,
URLA kum plajında Full Deniz Manzaralı KOMPLE Satılık BİNA,3,1,Yerden Isıtma,360.0,17.500.000 TL,
___444'DEN_­__KEMALPAŞA CADDESİNE 15 MT___GENÇ BİNA___10 YAŞINDA,3,1,Yok,115.0,8.750.000 TL,
GEDİZ SEVGİ YOLUNDA SATILIK KOMPLE BİNA,2,1,Doğalgaz (Kombi),120.0,7.300.000 TL,
ATATÜRK MAHALLESİ' NDE 2 DAİRELİ SIFIR BİNA,2,1,Doğalgaz (Kombi),130.0,5.900.000 TL,
KAMİL TUNCA BULVARI YAKINI MERKEZİ KONUMDA 4 KATLI BİNA,4,1,Doğalgaz (Merkezi),139.0,12.000.000 TL,
SALMAN'DAN SOĞUKKUYU MAH. YAKINI SATILIK KOMPLE 4 KATLI BİNA,4,1,Klima,148.0,4.900.000 TL,
Yeşilbağlar'da İsmail Sivri Bulv. Cad. Yakını Komple Bina,4,1,Doğalgaz (Kombi),116.0,10.000.000 TL,
KOZAĞAÇ MAHALLESİN'DE KOMPLE SATILIK 3 KATLI BİNA 2+1 DAİRELER,3,1,Doğalgaz (Kombi),100.0,5.250.000 TL,
ÇİĞLİ ATAŞEHİRDE KOMPLE SATILIK BİNA,2,1,Doğalgaz (Kombi),90.0,4.750.000 TL,
5 KAT İMARLI SATILIK KOMPLE BİNA,3,1,Soba,132.0,6.750.000 TL,
,,,,,,
GENÇEREN EMLAKTAN MENEMEN MERKEZDE KÖŞE KONUMLU KOMPLE BİNA,4,1,Doğalgaz (Kombi),480.0,14.500.000 TL,
BUCA MENDERES'DE YENİ YAPILACAK AVM KARŞISI SATILIK KOMPLE BİNA!,4,2,Doğalgaz Sobası,240.0,19.000.000 TL,
Işıl'dan Günaltayda Merkezi Konum Komple Satılık Bina,4,1,Doğalgaz (Kombi),150.0,5.000.000 TL,
Satılık Komple Bina (4 katlı ve 4 daireli),4,1,Klima,122.0,7.100.000 TL,
YEŞİLYURT'ta KÖŞE KONUMDA 3 KATLI SATILIK BİNA,3,1,Yok,104.0,2.700.000 TL,
SIFIR YERDEN ISITMALI BİNA,4,2,Yerden Isıtma,600.0,17.500.000 TL,
SATILIK BINA,3,1,Yok,324.0,4.000.000 TL,
ESKİ ÇAMLIK MEVLANA CAMİ YAKINI 3 KATLI 14 YAŞINDA BİNA,3,1,Klima,113.0,2.350.000 TL,
Bornova Merkezde Komple Satılık 6 Katlı Bina (6 Daire+1 Dükkan),6,1,Doğalgaz (Kombi),1.0,35.000.000 TL,
"SAHIBINDEN ENHOSLAR, EFELER MAH. ANA CADDEDE 3 KATLI KOMPLE BINA",3,1,Doğalgaz (Kombi),110.0,13.250.000 TL,
Urla İçmeler Mahallesinde Satılık Komple Bina,3,1,Yok,240.0,9.000.000 TL,
BORNOVA ATATÜRK MAHALLESİNDE KOMPLE SATILIK BİNA,5,1,Doğalgaz (Kombi),48.0,5.800.000 TL,
İ-LİFE EMLAKTAN SATILIK KOMPLE 2 BİNA 369 M2 SANAYİİ İMARLI,3,2,Yok,369.0,19.150.000 TL,
ÖZDERE ORTAMAHALLE'DE SATILIK BİNA,3,2,Klima,322.0,14.500.000 TL,
KARACAOĞLAN BÜYÜK FIRSAT ! 2 KAT 3 DAİRE KÖŞE ULUCAMİ KARŞI,3,2,Yerden Isıtma,128.0,11.000.000 TL,
ÇİĞLİ BALATÇIK' ta SATILIK KOMPLE BİNA PROJE HOME' dan,4,1,Klima,120.0,6.500.000 TL,
KARABAĞLAR MİNA CAMİSİ SOKAĞINDA 4 KATLI KOMPLE SATILIK BİNA,4,1,Klima,450.0,5.750.000 TL,
İNKİLAP METRO YANI 400M2 ARSASI OLAN BİNA,2,3,Soba,430.0,5.200.000 TL,
KONAK NAMIK KEMAL MH DENİZ MANZARA KEMERALTINDA 1+1 DUBLEKS BİNA,2,1,Soba,45.0,675.000 TL,
TAKAS OLUR SAHİBİNDEN MÜSTAKİL BAHÇELİ GARAJLI 3 KATLI BİNA,3,1,Soba,104.0,10.000.000 TL,
DUMLU'DAN NARLIDERE ILICA MAHALLESİNDE KOMPLE SATILIK BİNA,4,1,Jeotermal,129.0,17.000.000 TL,
__444'DEN__ 6 DÜKKAN + 2 DAİRE'DEN OLUŞAN FIRSAT BİNA,2,2,Klima,500.0,6.500.000 TL,
HERŞEYİ KENDİ EVİM İÇİN YAPTIM 5 YIL ÖNCE YAPILDI 4 KATLİ DEPO İ,4,1,Güneş Enerjisi,320.0,8.700.000 TL,
Kaçırılmayacak Fırsat! Geniş Satılık Doğalgaz (Kombi) Fiyat Düştü! Yok,6,1,Doğalgaz (Kombi),1.0,6.500.000 TL,
KENTSEL DÖNÜŞÜM BÖLGESİNDE YATIRIMLIK SATILIK BİNA,3,1,Soba,290.0,1.810.000 TL,
KEMALPAŞA ÖRENDE SATILIK BİNA,2,1,Yok,100.0,3.350.000 TL,
TURYAP 'TAN BUCA M KEMAL MAH ANAYOL YAKINI 6 KATLI KOMPLE BİNA,6,1,Doğalgaz (Kombi),147.0,15.000.000 TL,
SUNAR'dan BAYRAKLI YAMANLARDA 5 DAİRELİ BAHÇELİ OTOPARKLI BİNA,4,1,Klima,177.0,4.500.000 TL,
YATİRİMLİK MÜLK,4,1,Soba,280.0,14.500.000 TL,
"Urla, Yenikent'de, Yeni Bina Lüks Villa ve Dükkan Satılık",3,1,Yerden Isıtma,200.0,24.250.000 TL,
İSMAİL ÇELİK'TEN MUHTEŞEM LOKASYONDA SATILIK TİCARİ BİNA,3,1,Yok,1.6,160.000.000 TL,
İzmir Park Karşısı 4 Kat imarlı Tek Kat içinde ev bulunmaktadır.,1,1,Soba,120.0,2.575.000 TL,
KONAKTA MÜKEMMEL KONUMDA KOMPLE SATILIK BİNA,2,1,Klima,100.0,1.800.000 TL,
BUCA MENDERES MAH. MERKEZİ BİNA,3,1,Doğalgaz (Kombi),140.0,20.000.000 TL,
ÖZEN GAYRİMENKULDEN KOMPLE SATILIK BİNA,3,1,Doğalgaz (Kombi),540.0,23.500.000 TL,
İZMİR KEMALPAŞA ULUCAK SATILIK KOMPLE BİNA,4,1,Doğalgaz (Kombi),150.0,14.000.000 TL,
NEFT'TEN 3 ADET 2+1 PLAN PROJELİ İMARLI 130m2 ARSA PAYLI,3,1,Doğalgaz (Kombi),130.0,7.750.000 TL,
YILDIRIM BEYAZIT'TA FIRIN +TERASLI DAİRE KOMPLE SATILIK BİNA,2,1,Yok,120.0,6.000.000 TL,
MANAVKUYUDA MERKEZİ KONUMDA 4 KATLI YATIRIMLIK BİNA SATILIK,4,1,Doğalgaz (Kombi),105.0,14.250.000 TL,
DİPLOMA GAYRİMENKUL'DEN SATILIK KOMPLE BİNA VE ARSASI,3,1,Klima,105.0,6.450.000 TL,
MÜSTAKİL İKİ KATLI BİNA ÇELİK YAPIDAN,2,1,Doğalgaz (Kombi),100.0,3.600.000 TL,
Akay'dan Yeşilova'da Satılık Komple Bina,3,1,Klima,150.0,8.000.000 TL,
Urla Çeşmealtı' da Satılık Komple Bina,3,1,Doğalgaz (Kombi),210.0,23.800.000 TL,
Urla Merkez'de Satılık 250 m2 Arsa İçinde 3 Adet Bağımsız Taş Ev,2,3,Klima,300.0,15.000.000 TL,
Konak Güzelyalı Göztepe'de Banka Kiracılı Emsalsiz Ticari Mülk.,4,2,Klima,750.0,36.000.000 TL,
KARABAĞLAR YEŞİLLİK CADDESİNE YAKIN KONUMDA SATILIK BİNA,3,1,Soba,400.0,3.950.000 TL,
KOMPLE SATILIK 4 KAT 3+1 DAİRELER MEVKİSİ SÜPER,4,1,Doğalgaz (Kombi),120.0,6.000.000 TL,
Dostluk Bulvarında 2 Adet Daire 2 Adet Dükkanı Olan Satılık Bina,3,1,Yok,200.0,7.600.000 TL,
KOYUNDERE DE satılık ev bahçeli bına,3,1,Klima,120.0,6.650.000 TL,
KIRDAĞ İNŞ GAYRİMENKUL SATILIK BİNA,3,1,Klima,165.0,4.050.000 TL,
İZMİR BORNOVADA SATILIK BİNA,3,1,Soba,96.0,5.250.000 TL,
,,,,,,
TURPA SAYGINDAN 2 KATLI HASTANE YAKINI,2,1,Doğalgaz (Kombi),130.0,4.750.000 TL,
FIRSAT ÇEŞME ÇARŞIDA 180M2 ARSA İÇİNDE BİRİ TARİHİ İKİ KARGİR EV,2,3,Klima,320.0,12.500.000 TL,
ÇALIŞKAN_DAN YUNUS EMRE DE 2 KATLI SATILIK MÜSTAKİL BİNA.,2,1,Yok,160.0,3.700.000 TL,
İZMİR ÇANKAYADA KOMPLE SATILIK İŞYERİ-BİNA,4,5 +,Klima,360.0,7.500.000 TL,
BAYINDIR PINARLIDA SATILIK KARGİR KÖY EVİ İMARLI,1,1,Soba,70.0,455.000 TL,
KARABAĞLAR'DA MERKEZİ KONUMDA SATILIK BİNA,2,1,Yok,226.0,8.475.000 TL,
YILDIZ'DA SATILIK MÜSTAKİL BİNA 4 KATLI D.GAZLI 115M2 BAKIMLI,4,1,Doğalgaz (Kombi),115.0,6.500.000 TL,
URLA MERKEZ YELALTI MAHALLESİNDE 11 DAİRELİ KOMPLE SATILIK BİNA,3,3,Klima,252.0,17.000.000 TL,
Bayraklı Çay Mahallesi'nde Satılık 3/4 Arsa Hisseli Bina,4,1,Yok,105.0,3.300.000 TL,
177 METREKARE ARSALI 3 KATLI KÖŞE BAHÇELİ BİNA,3,1,Klima,177.0,6.550.000 TL,
Çiğli de Satılık Komple Bina,4,2,Doğalgaz (Kombi),750.0,24.900.000 TL,
KARABAĞLAR SANAYİDE MERKEZİ İŞLEK CADDEDE KOMPLE SATILIK BİNA,4,1,Klima,110.0,6.800.000 TL,
Çiğli Merkezde Satılık Komple Bina,5,5 +,Klima,1.055,28.500.000 TL,
ACİL MIZRAKLI CADDESİ 3KATLI TADİLATA UYGUN BİNA,3,1,Yok,300.0,3.000.000 TL,
İzmir Konak Umurbey Yatırım Fırsatı. 3 Katlı Komple Bina,3,1,Kalorifer,140.0,5.750.000 TL,
ÇİĞLİ KOLEJLER BÖLGESINDE SATILIK 7 KATLI OKUL BINASI,7,5 +,Doğalgaz (Merkezi),10.11,245.000.000 TL,
BUCA MUSTAFA KEMAL MAHDE YENİ KARAKOL YAKINI,3,1,Klima,114.0,3.950.000 TL,
Acil satılık bina,3,1,Soba,120.0,3.000.000 TL,
İzmir Agora Satılık Tescilli Konak,3,1,Klima,345.0,9.500.000 TL,
FEVZİPAŞA BULVARINDA 180m2 ZEMİN 10 KATLI SATILIK BİNA,9 +,1,Klima,180.0,49.850.000 TL,
BUCA UFUK MAH ÇAMLIKTA SATILIK 2 KATLI BİNA,2,1,Doğalgaz (Kombi),100.0,5.500.000 TL,
narlıdere limanreiste deniz manzaralı satılık müstakil bina,2,1,Doğalgaz (Merkezi),152.0,10.550.000 TL,
"İzmir, Kemalpaşa, Çınar Sanayi'de Komple Satılık Bina",3,1,Yok,100.0,3.300.000 TL,
BUCA OKULLAR BÖLGESİ,3,3,Doğalgaz (Kombi),300.0,13.000.000 TL,
YEŞİLYURTTA SATILIK 300 M2 DAİRE EŞYALI,4,2,Doğalgaz (Merkezi),300.0,6.950.000 TL,
BORNOVA IŞIKLAR DA 7300m2 KAPALI ALANA SAHİP SATILIK KOMPLE BİNA,5,5 +,Doğalgaz (Kombi),7.3,160.000.000 TL,
İZMİR KARABAĞLAR PEKER MH. SATILIK 2 KATLI BİNA,2,1,Yok,123.0,3.300.000 TL,
URLA MERKEZDE MALGACA PAZARI YANI EMSALSİZ SATILIK KOMPLE BİNA..,2,1,Klima,210.0,8.250.000 TL,
Çeşme merkezde müstakil bina,2,1,Klima,88.0,8.000.000 TL,
EGRİDERE KÖKÜNDE 700 M ARSA 2 KAT MALİKANE FULL MANZARALI,2,1,Klima,110.0,9.950.000 TL,
3katlı Satılık Bina,2,5 +,Klima,173.0,12.000.000 TL,
SEFERİHİSAR SIĞACIK MERKEZDE SATILIK KOMPLE BİNA,3,1,Klima,260.0,15.500.000 TL,
KONAK KEMERALTINDA SATILIK BİNA,4,2,Klima,49.0,16.000.000 TL,
BUCA M KEMALDE 3 KATLI BİNA 5 AYRI TAPULU 5DAİRE SATILIKTIR,3,2,Doğalgaz (Kombi),502.0,6.500.000 TL,
Karabağlar Selvili Mah.Kat Mülkiyetli Komple Satılık Bina,2,2,Doğalgaz (Merkezi),165.0,3.500.000 TL,
İzmire 6 dakika masafede komple satılık apartman.,3,1,Doğalgaz (Kombi),122.0,6.800.000 TL,
Acil satılık komple bina,3,1,Yok,164.0,8.500.000 TL,
#NUR GAYRİMENKUL# ÇİÇEK MAH. MANZARALI 4 KATLI SATILIK BİNA,4,1,Kalorifer,140.0,4.450.000 TL,
"BAYRAKLI SEVGİ YOLU, MERKEZ CAMİİ YAKINI , KULLANIŞLI,­SAHİBİNDEN",4,1,Klima,115.0,12.500.000 TL,
MERKEZİ KONUMDA ÖNÜ AÇIK FERAH MANZARALI KOMPLE SATILIK 4 KAT,4,1,Doğalgaz (Kombi),120.0,10.000.000 TL,
KOMPLE SATILIK 4 KATLI BİNA,4,1,Soba,120.0,8.000.000 TL,
"___444'DEN___MERKEZİ KONUMDA KOMPLE SATILIK 3 DAİRE, 1 DÜKKAN",3,3,Doğalgaz (Kombi),120.0,5.600.000 TL,
KARABAĞLAR YUNUS EMRE MAH. KOMPLE BİNA,3,1,Doğalgaz (Kombi),470.0,7.400.000 TL,
Bornova Mevlana Mahallesinde Yatırımlık Satılık Komple Bina,3,1,Doğalgaz (Kombi),101.0,10.500.000 TL,
KOMPLE SATILIK BİNA KARABAĞLAR MERKEZDE UYGUN FİYATA,3,1,Doğalgaz (Kombi),130.0,3.500.000 TL,
__444'DEN__ PINARBAŞI MERKEZDE KOMPLE SATILIK FIRSAT BİNA,3,2,Doğalgaz (Kombi),171.0,4.375.000 TL,
Menemen Gazi Mahallesi'nde Satılık 3 Katlı Bina,3,1,Yok,220.0,8.000.000 TL,
Çiğli Ataşehir Mahallesi'nde Satılık Komple Bina,5,1,Klima,55.0,40.000.000 TL,
İZMİR BAYRAKLI TEPEKULE MAHALLESİ SATILIK BİNA,3,1,Soba,120.0,7.250.000 TL,
KARABURUN MERKEZİNDE DOĞAYLA İÇ İÇE KOMPLE SATILIK BİNA,3,1,Yerden Isıtma,184.0,10.250.000 TL,
,,,,,,
Işıl Gayrimenkulden 3 Katlı Komple Satılık Bina Mükemmel Konumda,3,2,Klima,95.0,3.300.000 TL,
İZMİR URLA ZEYTİNALANINDA ÇEŞME YOLU ÜZERİ SATILIK KOMPLE MÜLK,2,2,Klima,710.0,150.000.000 TL,
ALPASLANDA 121 M2 / 2 KATLI SATILIK BİNA,2,1,Yok,121.0,1.600.000 TL,
URLA MERKEZDE SANAT SOKAĞINA 5 DK YATIRIMLIK SATILIK BİNA,3,4,Yok,350.0,21.000.000 TL,
Çiğli Balatçıkta 4 Katlı Satılık Bina,4,1,Klima,200.0,10.250.000 TL,
BUCA YEŞİLBAĞLAR'DA 4 KATLI KOMPLE SATILIK BİNA,4,1,Doğalgaz (Kombi),150.0,16.000.000 TL,
sahibinden 3 katlı komple bina,3,1,Doğalgaz (Kombi),147.0,5.500.000 TL,
ŞİRİNYER MERKEZ KONUMLU 3 DAİRE 1 DÜKKAN YATIRIM FIRSATI,4,1,Doğalgaz (Kombi),130.0,12.500.000 TL,
BALTAŞ GAYRİMENKUL BORNOVA ATATÜRK MAH SATILIK 3 KATLI,3,1,Doğalgaz (Kombi),315.0,6.400.000 TL,
KOMPLE SATILIK 3 KAT İDEAL BİR BİNA,3,2,Soba,113.0,2.650.000 TL,
SAHİBİNDEN satılık 2 katlı bina,2,1,Doğalgaz (Kombi),130.0,10.000.000 TL,
KARŞIYAKA MERKEZ KOMPLE BİNA VE 13 ODALI SATILIK OTEL,5,1,Doğalgaz (Kombi),550.0,17.950.000 TL,
HALİL RIFAT PAŞA CADDESİ ÜZERİ KOMPLE SATILIK BİNA,3,1,Soba,198.0,3.200.000 TL,
URLA DA YATIRIM FIRSATI SATILIK AVLULU TAŞ EV & BUTİK OTEL,2,1,Yok,222.0,6.600.000 TL,
EVKA3 MAH. KOMPLE SATILIK BİNA,3,1,Doğalgaz (Kombi),180.0,5.200.000 TL,
Satılık 3 katlı bina,3,1,Klima,92.0,2.750.000 TL,
"PINARBAŞI'INDA SATILIK 2,5 KATLI BİNA",2,1,Soba,121.0,3.150.000 TL,
