1,2,3,4,5,6,7
İzmir Bergama Maruflar'da Tek katlı 2 Adet Konut ve Arsası,1.0,1,Yok,100.0,500.000 TL,
ÇİFTLİK MERKEZ'DE KOMPLE SATILIK TİCARİ RUHSATLI BİNA,2.0,5 +,Klima,150.0,17.000.000 TL,
KUZEY EMLAKTAN KOMPLE SATILIK 3 KATLI MÜSTAKİL BİNA,3.0,1,Yok,205.0,3.000.000 TL,
,,,,,,
BOZYAKA DALGIÇLAR FIRIN YAKINI 3 KATLI SATILIK MÜSTAKİL BİNA,3.0,1,Doğalgaz (Kombi),108.0,5.150.000 TL,
KOMPLE BİNA ve ARSA,2.0,2,Klima,800.0,12.000.000 TL,
LEVENT MAH GÜNEY MAH 3 KATLI BİNA ARAÇ TAKASI DEĞERLENDİRİLİR,3.0,1,Yok,60.0,810.000 TL,
Fiyat düştü Acil satılık!!! Resmi Tapulu Bina,3.0,1,Doğalgaz (Kombi),120.0,8.100.000 TL,
ILICA PLAJINA 50 METRE MESAFEDE KOMPLE SATILIK BINA,2.0,1,Klima,188.0,29.500.000 TL,
ARGA'DAN BUCA GÖKSU MH.D.GAZLI KOMPLE SATILIK BİNA.,3.0,1,Doğalgaz (Kombi),390.0,7.750.000 TL,
İzmir Bornova da Komple Satilik Bina,5.0,1,Doğalgaz (Merkezi),1.1,28.000.000 TL,
İZMİR /BORNOVA /PINARBAŞIDA SATILIK MÜSTAKİL EV,3.0,2,Doğalgaz (Kombi),426.0,7.000.000 TL,
꧁ASEL꧂HİPODRUM ARKASI 4 DAİRELİ 10 YAŞINDA KOMPLE SATILIK BİNA,4.0,1,Doğalgaz (Kombi),125.0,15.850.000 TL,
Turyap-Fırsat Cadde Üzeri Satılık Dükkan Daire Komple Bina,3.0,2,Klima,450.0,7.900.000 TL,
Bayraklı Onur Mahallesinde Avantajlı Satılık Komple Bina,4.0,1,Doğalgaz (Kombi),160.0,8.000.000 TL,
Osmangazi'de Satılık Komple Bina,4.0,1,Klima,350.0,5.700.000 TL,
ÇİMEN EMLAK'TAN SATILIK MÜKEMMEL KONUMLU KOMPLE BİNA,4.0,2,Klima,950.0,25.000.000 TL,
BAYRAKLI'DA SATILIK FIRSAT MÜSTAKİL EV,2.0,1,Soba,245.0,2.800.000 TL,
REZERVE'den FIRSAT! İçmeler'de 3 katlı BİNA 3 ayrı DAİRE,3.0,1,Klima,445.0,8.500.000 TL,
URLA GÜLBAHÇE 13 ADET 1+1 EMSALSİZ ÖĞRENCİ YURDU,3.0,4,Kalorifer,600.0,45.000.000 TL,
KONAK HİLTON YAKINI OTELLER BÖLGESİNDE TAMAMINA TAKAS BİNA,3.0,1,Yok,90.0,22.500.000 TL,
Komple Satılık Bina 5 Daire Bir Dükkan Bir Otopark 7 Ruhsatlı,6.0,1,Doğalgaz (Kombi),106.0,11.000.000 TL,
EŞREF PAŞADA SATILIK BİNA KONAĞA 10 DAKİKA MESAFEDE TAKAS OLUR,3.0,2,Soba,300.0,2.450.000 TL,
ALTINDAĞ'DA HER DAİRESİ KAT MÜLKİYET TAPULU SATILIK 4 KATLI BİNA,4.0,1,Doğalgaz (Kombi),360.0,6.750.000 TL,
IZMIR ISIKKENTTE 200M2 ZEMINDE TOPLAMDA 1200 M2 LIK KOMPLE BINA,6.0,1,Klima,1.2,21.000.000 TL,
DEMİR EMLAKTAN TORBALI MAHALLESİNDE LÜKS 2+1,4.0,2,Doğalgaz (Kombi),90.0,2.750.000 TL,
Aydınlıkevler De Mükemmel Konum 5 Ayrı Tapu Komple Satılık Bina,4.0,1,Doğalgaz (Kombi),500.0,19.750.000 TL,
Gaziemir'de Yatırımlık Restore Edilmiş Satılık Taş Ev,2.0,2,Klima,489.0,39.500.000 TL,
DG'DEN SATILIK 540 M2 KÖŞE ARSA İÇİNDE YASAL 5 KATLI BİNA,5.0,1,Doğalgaz (Kombi),600.0,19.000.000 TL,
BUCA YILDIZ MAHALLESİNDE KOMPLE SATILIK BİNA 4 DAİRE 1 DÜKKAN,4.0,1,Doğalgaz (Kombi),125.0,13.200.000 TL,
İZMİR URLA CADDEDE MÜTHİŞ KİRA GETİRİLİ SATILIK RESİDENCE - BİNA,4.0,5 +,Klima,2.0,200.000.000 TL,
ÖZEN GAYRİMENKULDEN ANA CADDE ÜZERİ SATILIK BİNA,3.0,1,Doğalgaz (Kombi),400.0,17.500.000 TL,
İZMİR BUCA UFUK MAHALLESİ 5 KATLI BİNA,5.0,1,Doğalgaz (Kombi),750.0,22.000.000 TL,
EVREN YAŞAM KONAKLARI SATILIK LÜX VİLLA,2.0,1,Doğalgaz (Kombi),148.0,6.500.000 TL,
ÇEŞME ÇARŞI DA FAAL 2 DÜKKAN VE 2 DAİRE KÖŞE KOMPLE BİNA,3.0,4,Klima,300.0,65.000.000 TL,
Artı Emlaktan Buca Kozağaçta 5 daire li Komple Bina,5.0,1,Doğalgaz (Kombi),115.0,12.100.000 TL,
MENEMEN ASARLIK'DA KÖŞE BAŞI KOMPLE SATILIK 3 KATLI BİNA,3.0,1,Soba,181.0,3.300.000 TL,
KURA'dan BAYRAKLI ÇİÇEK MAHALLESİNDE TADİLATLI 3 KATLI BİNA,3.0,1,Klima,99.0,3.500.000 TL,
MUĞLA MİLAS SÜGÜTCÜK TE İKİ KATLI KÂGİR EV ALA EMLAK TAN SATILI,2.0,4,Yok,287.0,2.500.000 TL,
BUCA'DA SATILIK İMAR BARIŞLI 3 KATLI BİNA,3.0,1,Soba,100.0,4.000.000 TL,
"3 Ad. 3+1, 1 Ad. 2+1 Daire olan BİNA, YATIRIM VE KAZANÇ FIRSATI",4.0,1,Doğalgaz (Kombi),450.0,15.500.000 TL,
Sahibinden satılık taş bina,3.0,1,Soba,328.0,30.500.000 TL,
KOMPLE SATILIK 3 KAT 123 M2 ÇİFT CEPHE GÜZEL BİR BİNA,3.0,3,Soba,123.0,4.425.000 TL,
BAYRAKLI OSMANGAZİ MAHALLESİ SATILIK KOMPLE BİNA,4.0,1,Doğalgaz (Kombi),725.0,27.500.000 TL,
BORNOVA İNÖNÜ MAH. SATILIK DÜKKAN VE 1+1 DAİRE,1.0,1,Yok,70.0,2.500.000 TL,
Menemen Asarlık Mahallesinde Gölpark Cepheli Satılık Binalı Arsa,1.0,1,Soba,156.0,1.300.000 TL,
Dr. Emlak'tan Refet Bele Mah. Satılık 4 Daire 1 Dükkan Bina,4.0,1,Soba,134.0,4.500.000 TL,
Dr. Emlak'tan Günaltay Mah. 5 Katlı Bina,5.0,1,Soba,100.0,5.250.000 TL,
Bostanlıda Ayrık Nizam Köşe Konumlu Komple Satılık Bina,5.0,2,Doğalgaz (Kombi),1.3,75.000.000 TL,
ŞAKRAN BOZBURUN MEVKİİNDE SATILIK 2 ADET YAZLIK VİLLA,2.0,2,Doğalgaz (Kombi),400.0,25.000.000 TL,
Konak tuzcu mahallesinde 247Metre4+1 2 daire 1 dükkan,2.0,2,Soba,247.0,3.650.000 TL,
SUNAR'dan MEDİKAL YANI ÖRNEKKÖYde ALTI DÜKKAN ÜSTÜ 2 DAİRE&TERAS,3.0,1,Doğalgaz (Kombi),135.0,4.700.000 TL,
ÇALIŞKAN_DAN AYDIN MAH İKİ KATLI BİNA 2.500BNE ACİLEN SATILIKTIR,2.0,1,Yok,178.0,2.500.000 TL,
KOMPLE SATILIK 2.5 KAT ÇATILI BİNA,2.0,1,Doğalgaz (Kombi),100.0,5.500.000 TL,
,,,,,,
BORNOVADA SATILIK KOMPLE BİNA,3.0,1,Doğalgaz (Merkezi),145.0,3.750.000 TL,
BUCA IŞIKLI PARK YAKINI 4 KATLI OTOPARKLI GENİŞ BINA,4.0,1,Doğalgaz (Kombi),287.0,8.000.000 TL,
ÇALIŞKAN_DAN YUNUS EMRE MERKEZDE 4 DAİRE 2 DÜKKAN KOMPLE SATILIK,3.0,2,Klima,200.0,6.500.000 TL,
Urla Sanat Sokağı Yakını Tamamı Yenilenmiş Satılık Bina - 6 Tapu,2.0,5 +,Doğalgaz (Kombi),292.0,30.000.000 TL,
AİLE BİNASI,4.0,1,Doğalgaz (Kombi),700.0,12.350.000 TL,
EMLAKMATİK TEN EGRİDERE DE FIRSAT KOMPLE SATILIK BİNA 11 DAİRE,5.0,2,Doğalgaz (Kombi),190.0,29.200.000 TL,
BASMANE YATIRIMLIK FIRSAT SATILIK 3 KATLI SATILIK BİNA,3.0,2,Yok,200.0,3.100.000 TL,
Sahibinden 3 katlı müstakil ev,3.0,1,Klima,76.0,6.000.000 TL,
ÇANDARLI MERKEZDE SATILIK DÜKKAN&OTEL,3.0,1,Klima,600.0,30.000.000 TL,
YUKARIKALABAK KÖYÜ İÇİNDE MÜSTAKİL AVLULU KARGİR EV,1.0,1,Soba,222.0,605.000 TL,
Bornova Çamdibi De Satılık Bina 5 senelik yeni,2.0,1,Doğalgaz (Kombi),160.0,6.250.000 TL,
BUCA YEŞİLBAĞLAR MAH/DE SATILIK 4 KATLI BİNA,4.0,1,Doğalgaz (Kombi),155.0,8.750.000 TL,
KARABAĞLAR YEŞİLLİK CADDESİNE YAKIN SATILIK 4 KATLI BİNA,4.0,1,Yok,600.0,6.200.000 TL,
BORNOVA ATATÜRK MAHALLESİNDE 4 DAİRE 1 DÜKKAN SATILIK,4.0,1,Doğalgaz (Kombi),130.0,13.500.000 TL,
Karabağlar Yeşilyurt Satılık 4 Katlı Bina,4.0,1,Klima,436.0,4.350.000 TL,
KARABAĞLAR BOZYAKA' DA ANA CADDE ÜZERİ KÖŞE BİNA 3 KATLI,3.0,1,Doğalgaz (Kombi),147.0,16.250.000 TL,
CB PRİME'DAN Balçova İSTİNYE PARK YAKINI SATILIK KOMPLE BİNA,3.0,1,Klima,140.0,26.600.000 TL,
YEŞİLOVADA SATILIK 4 KATLI BİNA,4.0,1,Yok,105.0,7.000.000 TL,
꧁ASEL꧂ATATÜRK MAH. 10 YAŞINDA KAT MÜLKİYETLİ KOMPLE SATILIK BİNA,3.0,1,Doğalgaz (Kombi),160.0,8.990.000 TL,
URLA MERKEZDE 2 ADET 3+1 DAİRE 1 ADET DÜKKAN SATILIK KOMPLE BİNA,3.0,1,Yok,516.0,15.500.000 TL,
URLA MERKEZ TAŞ BİNA,1.0,1,Yok,210.0,16.500.000 TL,
TARİHİ AGORA YAKINI 329 m2 ZEMİN X 2 kat FAAL BİNA SATILIKTIR,2.0,2,Klima,329.0,18.000.000 TL,
Karşıyaka Örnekköy'de Satılık Komple Bina,4.0,1,Doğalgaz (Kombi),80.0,5.900.000 TL,
İzmir'in En Değerli Konumunda Satılık Komple Bina,8.0,1,Doğalgaz (Kombi),768.0,108.000.000 TL,
BUCA NIN YENI GÜN MAH. BÖLGESİN' DE KOMPLE VE TEK TEK SATILIK,3.0,2,Klima,95.0,13.750.000 TL,
YAŞANIR DAN BORNOVA ALTINDAĞ MEVİNDE SATILIK 2 KATLI KOPMLE BİNA,2.0,1,Yok,160.0,1.650.000 TL,
GÖKHAN DOĞAN'DAN SELVİLİ'DE 3 KATLI DOĞALGAZLI KOMPLE BİNA,3.0,1,Doğalgaz (Kombi),118.0,3.300.000 TL,
GAZİ OSMAN PAŞA MAH NEST SİTESİ KARŞI SOKAĞI KOMPLE SATILIK BİNA,2.0,1,Doğalgaz (Kombi),115.0,3.490.000 TL,
İzmir Konak'da Deniz Manzaralı 3 katlı Bina Araç Takası Olur,3.0,1,Klima,83.0,1.200.000 TL,
GÜNALTAY'DA 208M2 ARSA ÜZERİNDE 2KAT 4 DAİRE,2.0,2,Soba,208.0,2.650.000 TL,
AKEVLER CİVARI 3 DAİRE BİRDEN 2 ADET 3+1 1 ADET 1+1 FIRSAT,3.0,1,Soba,100.0,1.900.000 TL,
BUCA GÖKSU MAHALLESİNDE 3 KATLI SATLIK BİNA,3.0,1,Doğalgaz (Kombi),110.0,2.750.000 TL,
Satılık Doğalgaz (Kombi) Lüx Emsalsiz Konumda  Emlak Ofisinden Ferah,3.0,1,Doğalgaz (Kombi),141.0,5.900.000 TL,
BAYRAKLI EMEK MAHALLESİNDE SATILIK 4 KATLI BİNA,4.0,1,Klima,178.0,5.050.000 TL,
BAYRAKLI GÜMÜŞPALA'DA KOMPLE SATILIK 2 KATLI BİNA,2.0,1,Yok,94.0,3.130.000 TL,
GIDA ÇARŞISINDA MÜKEMMEL KONUMDA SATILIK 4 KATLI BİNA,4.0,4,Klima,230.0,15.000.000 TL,
"CEMİL HASEKİOĞLU'NDAN 121 M TEK TAPU,İMARLI,MUHTEŞEM KONUM",3.0,1,Yok,121.0,4.000.000 TL,
ALTINDAĞ'DA 2 DÜKKAN VE 2 DAİRESİ BULUNAN KOMPLE SATILIK BİNA,3.0,1,Yok,194.0,2.500.000 TL,
BUCA ATATÜRK MAHALLESİNDE MUSTAKİL 3 KATLI BİNA,3.0,1,Doğalgaz (Kombi),350.0,6.000.000 TL,
İZMİR BORNAVA'DA 4 KATLI KOMPLE SATILIK BİNA,4.0,1,Doğalgaz (Kombi),100.0,9.000.000 TL,
URLA KALABAK'TA TABELA DEĞERİ YÜKSEK İŞLEK YOL ÜZERİ KOMPLE BİNA,3.0,1,Yerden Isıtma,1.35,145.000.000 TL,
Bayraklı Gümüşpala'da Köşe Konumlu Komple Satılık Bina,3.0,1,Yok,512.0,7.500.000 TL,
MERKEZDE ÖNÜ AÇIK KÖŞE KONUMDA 3 KATLI SATILIK KOMPLE BİNA,3.0,1,Doğalgaz (Kombi),280.0,4.750.000 TL,
YUNUS EMRE MAHALLESİNDE 3+1 KOMPLE SATILIK BİNA DÜKKAN DAHİL,4.0,1,Doğalgaz (Kombi),120.0,10.000.000 TL,
SERKAN SARI'DAN SATILIK KOMPLE BİNA 3 KAT 3 CEPHE ACİL SATILIK,3.0,1,Doğalgaz (Kombi),250.0,10.250.000 TL,
GÜLTEPE MURAT MAH. 168 m2 SATILIK KOMPLE BİNA 2.500.000 TL,4.0,2,Soba,168.0,2.500.000 TL,
DAİRE FİYATINA 6 YAŞINDA 3 KATLI SATILIK BİNA,3.0,1,Doğalgaz (Kombi),141.0,6.750.000 TL,
Turyap'tan Satılık 3 Katlı Yatırımlık Müstakil Bina,3.0,1,Doğalgaz (Kombi),130.0,4.200.000 TL,
Urla Sanat Sokağı'nda Satılık Taş Bina,2.0,1.0,Yok,208.0,17.000.000 TL,
BOZYAKA SEVGİ MAHALLESİNDE 4 KATLİ SATILIK BİNA,4.0,1.0,Doğalgaz (Kombi),120.0,6.280.000 TL,
Yeşildere 2katli,3.0,3.0,Soba,127.0,1.600.000 TL,
,,,,,,
BAHAR MAHALLESİNDE 3 KATLI BİNA,3.0,1.0,Doğalgaz (Kombi),120.0,4.500.000 TL,
ALİAĞA FORZA EMLAK'TAN ATATÜK CAD.KOMPLE SATILIK BİNA,4.0,2.0,Doğalgaz (Kombi),110.0,17.500.000 TL,
YEŞİM EMLAKTAN ZÜBEYDE HANIM MAHALLESİNDE SATILIK 2 KATLI BİNA,2.0,1.0,Klima,120.0,7.600.000 TL,
URLA İÇMELERDE 3 DAİREDEN OLUSAN SATILIK BİNA,3.0,1.0,Klima,75.0,6.500.000 TL,
ÇİĞLİ GÜZELTEPE'DE SATILIK AVLULU EV,2.0,1.0,Soba,80.0,3.000.000 TL,
KOMPLE SATILIK BİNA 5 KATLI ŞEHİR MANZARALI 2+1'LER,5.0,1.0,Klima,102.0,5.525.000 TL,
MAVİŞEHİR İZBAN VE ANADOLU CAD. 2 DAKİKA MESAFEDE SATILIK BİNA,4.0,1.0,Soba,166.0,7.200.000 TL,
Yenifoça Burunucu Mevkiinde Komple Satılık 3 Katlı Bina,3.0,1.0,Doğalgaz (Kombi),213.0,18.500.000 TL,
URLA ZEYTİNALANI'DA SATILIK BİNA,3.0,1.0,Doğalgaz (Kombi),330.0,29.650.000 TL,
BAYRAKLI NAFİZ GÜRMAN MH DENİZ MANZARALI SATILIK KOMPLE BİNA,2.0,1.0,Yok,141.0,5.500.000 TL,
İzmir Konak Ferahlı'da Satılık Bina,4.0,1.0,Soba,73.0,3.250.000 TL,
Bu Fiyata Yok! Satılık Emlak Ofisinden  Yok Son 3 gün! Hastalık Sebebiyle,4.0,1.0,Yok,100.0,5.500.000 TL,
__444'DEN__ 34.000 TL KİRA GETİRİLİ KOMPLE YAPILI EŞYALI BİNA,2.0,3.0,Klima,100.0,2.500.000 TL,
satılık 2 kat 3 daire ve arsa,2.0,1.0,Güneş Enerjisi,110.0,3.500.000 TL,
BOZYAKA SEVGİ MAHALLESİNDE 3 KATLI SATILIK BİNA,3.0,1.0,Doğalgaz (Kombi),110.0,5.180.000 TL,
BULUR'DAN 2 KATLI BAHÇELİ TERASLI MÜSTAKİL EVİMİZ SATILIKTIR,2.0,1.0,Soba,160.0,1.750.000 TL,
ERA NİVA'DAN BORNOVA PINARBAŞI'NDA SATILIK BİNA,1.0,1.0,Yok,119.0,3.100.000 TL,
EPA VIZYON 2' DEN ALACATI ICINDE OTELE UYGUN VILLA,2.0,2.0,Yok,249.0,26.500.000 TL,
"ÇİĞLİ, ATAŞEHİR DE, SATILIK 112 m2 YATIRIMLIK 2 KATLI BİNA",2.0,1.0,Doğalgaz (Kombi),112.0,3.900.000 TL,
SATILIK ANA YOL ÜZERİ 162 M2 KÖŞE 4 KATLI BİNA/ 2 DÜKKAN 3 DAİRE,4.0,1.0,Doğalgaz (Kombi),162.0,17.000.000 TL,
İZMİR BAYRAKLIDA 4 KATLI İÇİNDE KİRACISI MEVCUT,4.0,1.0,Yok,100.0,4.685.000 TL,
REMAX BEST'TEN GÜMÜŞPALA MERKEZDE KÖŞE KONUMDA SATILIK BİNA,2.0,1.0,Klima,200.0,2.750.000 TL,
"KEMERALTI , HAREKETLİ BİR SOKAKDA 110 m2 (KOMPLE BİNA)",2.0,1.0,Yok,110.0,7.850.000 TL,
ÖZBEY MAHALLESİNDE 3 DAİRELİK SATILIK MÜSTAKİL APARTMAN,3.0,1.0,Doğalgaz (Kombi),310.0,4.250.000 TL,
KARABAĞLAR MERKEZ'DE ESERKENT'TE 132 m2 2 Katlı BİNA SATILIKTIR.,2.0,1.0,Yok,132.0,2.750.000 TL,
14 MAYIS MAH. YILBAŞINA KADAR GEÇERLİ İNDİRİMLİ FİYAT 2+1 DAİRE,3.0,1.0,Doğalgaz (Kombi),110.0,1.725.000 TL,
Sahibinden muhteşem lokasyonda 5 katlı bina,5.0,1.0,Doğalgaz (Kombi),130.0,13.850.000 TL,
KOZAĞAÇ MAHALLESİN'DE KOMPLE SATILIK 3 KATLI BİNA 2+1 DAİRELER,3.0,1.0,Doğalgaz (Kombi),100.0,5.250.000 TL,
!!ÖZEL OKUL RUHSATLI KİRACILI KOMPLE BİNA!!,4,1,Doğalgaz (Kombi),1.25,13.500.000 TL,
SUBAYEVLERİ'NDE 8 ADET 2+1 DAİREYE SAHİP KOMPLE SATILIK BİNA,3,2,Doğalgaz (Kombi),600.0,14.750.000 TL,
Yenimahalle'de Komple Satılık Bina,3,2,Doğalgaz (Kombi),900.0,17.500.000 TL,
,,,,,,
Hastalık Sebebiyle Doğalgaz (Kombi) Kaçırılmayacak Fırsat! Çok Uygun Bina Emlak Ofisinden,3,1,Doğalgaz (Kombi),275.0,13.500.000 TL,
TOKİ KONUTLARI İÇİNDE 7.000 M2 ÖZEL OKUL BİNASI,4,5 +,Doğalgaz (Merkezi),7.0,65.900.000 TL,
KEÇİÖREN'DE KOMPLE SATILIK BİNA 6 TANE 3+1 GETİRİLİ,3,3,Doğalgaz (Kombi),340.0,16.000.000 TL,
KAHRAMAN KAZAN SANAYİNDE SATILIK FABRİKA BİNASI,1,1,Doğalgaz (Merkezi),900.0,22.000.000 TL,
ÇANKAYA CADDESİ ÜZERİ BOTANİK PARK KARŞISI SATILIK KOMPLE BİNA,4,5 +,Doğalgaz Sobası,2.5,100.000.000 TL,
İki katlı evli İstabul yoluna cephe,2,1,Doğalgaz (Kombi),500.0,3.500.000 TL,
ALTINDAĞ İSKİTLER SATILIK BİNA,4,2,Soba,391.0,16.000.000 TL,
KURUMSAL MARKETLERDEN OLUŞAN 400.000 TL NET KİRA GETİRİLİ,4,5 +,Doğalgaz (Kombi),2.0,185.000.000 TL,
ÇANKAYA EMEK MAH YÜKSEK KİRA GETİRİLİ UYGUN FİYATLI SATILIKBİNA,3,1,Doğalgaz (Kombi),275.0,5.750.000 TL,
Bozyaka Ssk Yakını Ayrı Tapulu Komple Bina,5,1,Doğalgaz (Kombi),130.0,9.750.000 TL,
,,,,,,
BUCA FIRAT MAH/DE SATILIK 4 BUÇUK KATLI KÖŞE BİNA,4,1,Klima,121.0,6.250.000 TL,
merkezi yerde üçyol da iki katlı bina,2,1,Doğalgaz (Kombi),90.0,3.200.000 TL,
,,,,,,
BUCA FIRAT MAH/DE SATILIK 6 DAİRE 2 DÜKKAN AYRI TAPULU BİNA,4,2,Doğalgaz (Kombi),230.0,15.500.000 TL,
"URLA İSKELEDE ÖZEL KONUM,DENİZE 50 M. ÇOK AMAÇLI SATILIK BİNA",3,1,Klima,232.0,35.000.000 TL,
Yok Bina Çok Uygun Kaçırılmayacak Fırsat! Doğalgaz (Kombi) Lüx,2,1,Doğalgaz (Kombi),220.0,9.750.000 TL,
BABACAN'DAN ÇİĞLİ ŞİRİNTEPE'DE 3 KATLI SATILIK MÜSTAKİL BİNA,3,1,Klima,167.0,7.600.000 TL,
ALAÇATI'NIN KALBİNDE 4 BAĞIMSIZ BÖLÜMLÜ SATILIK KOMPLE BİNA,2,1,Klima,340.0,83.000.000 TL,
ERA NİVA'DAN BORNOVA 1 DÜKKAN 3 DAİRE SATILIK KOMPLE BİNA,2,1,Doğalgaz (Kombi),112.0,5.750.000 TL,
FIRAT MAH. SATILIK 4 BUCUK KATLI BİNA pazaryeri metro dolmuş,4,1,Klima,121.0,6.250.000 TL,
BAYRAKLI'DA KOMPLE SATILIK BİNA KUPON FİYAT...,2,1,Yok,70.0,1.900.000 TL,
Akay'dan Yeşilova'da Satılık Full Tadilatlı Lüks Komple Bina,4,1,Doğalgaz (Kombi),110.0,10.750.000 TL,
^^ACİL^^ Yatırımlık Sahibinden Ana Caddede Komple Satılık Bina,4,2,Yok,416.0,19.750.000 TL,
SELÇUK TARİHİ YARIMADA İÇİNDE KOMPLE SATILIK BİNA,3,3,Yerden Isıtma,1.5,31.500.000 TL,
GÜNEŞ GAYRİMENKUL'DEN KONAK KÜÇÜKADA MAH. SATILIK BİNA,2,1,Yok,150.0,1.500.000 TL,
Sahibinden Satılık #Fırsat,3,2,Doğalgaz (Kombi),350.0,4.650.000 TL,
"ERANİVA'DAN BORNOVA-ÜMİT MAHALLESİ'NDE SATILIK 2,5 KAT BİNA",2,1,Doğalgaz (Kombi),160.0,4.250.000 TL,
SATILIK 4 KATLI BİNA,4,1,Doğalgaz (Kombi),280.0,21.000.000 TL,
DİPLOMA GAYRİMENKUL' DEN KOMPLE VE TEK TEK SATILIK BİNA,4,1,Doğalgaz (Kombi),130.0,12.500.000 TL,
ERCİYES35'den SATILIK BİNA 4 AYRI DAIRE,5,1,Soba,90.0,2.650.000 TL,
Sahibinden Gültepede 3 katlı ev,3,1,Klima,85.0,2.950.000 TL,
ARTKEY DEN ÇAMKULEDE DENİZ MANZARALI 4 KATLI BİNA,4,1,Soba,128.0,6.250.000 TL,
KOMPLE SATILIK ÜÇ KATLI DENİZ MANZARALI BİNA,3,1,Doğalgaz (Kombi),218.0,9.000.000 TL,
Çiğli Merkezde Satılık 2 Katlı Bina Köşe Konumlu,2,1,Doğalgaz (Kombi),220.0,6.250.000 TL,
KARADAĞ GAYRİMENKULDEN KOMPLE SATILIK BİNA VE DAİRELER,4,1,Soba,400.0,7.750.000 TL,
Alsancak Saint Joseph Yakını Komple Satılık Bina,4,1,Klima,349.0,22.000.000 TL,
YEŞİLOVA İKON TOWERS-GARAJ-POİNT KARŞISI KOMPLE SATILIK BİNA,3,1,Klima,123.0,4.750.000 TL,
ANACADDE DE 2 İŞYERİ 2 KONUT BULUNAN YATIRIMLIK SATILIK BİNA,2,1,Soba,113.0,9.000.000 TL,
ERICA'DAN KOMPLE SATILIK 5 DAİRELİK SATILIK BİNA YATIRIM FIRSATI,2,3,Doğalgaz (Kombi),300.0,9.250.000 TL,
Hürriyet Mah Dükkan üstü 4 katlı 3+1 140 m2 bina komple satılık,4,1,Doğalgaz (Kombi),140.0,12.250.000 TL,
Bayraklı Onur Mahallesi'nde Satılık Bina,5,1,Soba,250.0,5.850.000 TL,
İZMİR BORNOVA ALTINDAĞDA SATILIK BİNA,6,1,Doğalgaz (Kombi),160.0,30.000.000 TL,
FIRSAT! Bornova Altındağ'da Daire Fiyatına Satılık Komple Bina,4,1,Doğalgaz (Kombi),450.0,4.200.000 TL,
Aliağa Devlet Hastanesi'nin Tam Karşısı Komple Satılık Bina,2,3,Klima,730.0,20.000.000 TL,
DUHA'DAN HÜRRİYET MAHALLESİNDE 4 KATLI KOMPLE SATILIK BİNA !!!,3,1,Doğalgaz (Kombi),224.0,6.500.000 TL,
AKINCILAR MAH. KOŞU İZBANA 2 DK. MESAFEDE KOMPLE SATILIK BİNA,3,1,Doğalgaz (Kombi),177.0,8.000.000 TL,
MTG'DEN BOZYAKA'DA SATILIK KİRA GETİRİLİ KOMPLE BİNA,4,1,Doğalgaz (Kombi),372.0,6.950.000 TL,
Dalgıçlar Çaprazı Merkezi Konumda 3 Katlı Satılık Komple Bina,3,1,Klima,510.0,5.000.000 TL,
1 Sanayi İçerisinde Satılık Komple Bina,4,1,Yok,340.0,15.500.000 TL,
İzmir Konak Komple Satılık Bina Açıklamayı okuyunuz,4,2,Soba,100.0,2.650.000 TL,
KOMPLE SATILIK BİNA MERKEZİ KONUMDA DENİZ MANZARALI.!!!,5,1,Doğalgaz (Kombi),125.0,9.500.000 TL,
İZMİR KARABAĞLAR SATILIK KOMPLE BİNA,2,1,Soba,135.0,2.750.000 TL,
ATATÜRK MAHALLESİ'NDE MERKEZİ KONUMDA SATILIK FIRSAT BİNA,2,1,Doğalgaz (Kombi),152.0,6.200.000 TL,
ERICA'DAN 7 DAİRELİK KOMPLE SATILIK BİNA FIRSAT YATIRIM İMKANI,4,2,Yerden Isıtma,350.0,14.750.000 TL,
BORNOVA MERKEZDE SATILIK KOMPLE KUPON BİNA,5,1,Doğalgaz (Merkezi),600.0,63.000.000 TL,
15 ODA İÇİN RUHSAT ALİNMİŞ BİNA,2,5 +,Doğalgaz (Kombi),356.0,33.000.000 TL,
"Bayraklı Çiçek Mahallesinde SATILIK 3,5 Katlı Komple Bina",4,1,Klima,85.0,6.500.000 TL,
Bornova' da Satılık Bina,3,1,Klima,100.0,4.700.000 TL,
BORNOVA DOĞANLAR'IN EN İŞLEK CADDESİNDE SATILIK BİNA,4,3,Yok,80.0,33.000.000 TL,
SALMAN'DAN FOÇA YAKINI ÇAKMAKLIDA SATILK KOMPLE VİLLA/BİNA,3,1,Doğalgaz (Kombi),280.0,5.100.000 TL,
500+500 M2 2 adet arsa içerisinde 3 kat bina.,3,1,Soba,420.0,21.000.000 TL,
MEVLANANIN GELİŞMEKTE OLAN LOKASYONUNDA 3 KATLI SATILIK BİNA,3,1,Doğalgaz (Kombi),156.0,7.950.000 TL,
BUCA KIZ KULESİ'NDE MERKEZİ KONUMDA SATILIK BİNA,5,1,Doğalgaz (Kombi),134.0,7.500.000 TL,
Egebay'dan 26 Ağustos Mah.sinde 2 Dükkan 2 daire 3 Katlı Bina,2,1,Klima,105.0,2.750.000 TL,
,,,,,,
MENEMEN EMİRALEM'DE ANAYOLA CEPHELİ SATILIK 2 KATLI BİNA,2,2,Klima,500.0,10.750.000 TL,
MERKEZİ YERDE 3+1 KARANLIK ODASI YOK KOMPLE SATILIK,5,1,Doğalgaz (Kombi),220.0,16.500.000 TL,
Menemen Ayvacık Mahallesinde Ultra Lüks Havuzlu SATILIK BİNA,3,1,Kalorifer,485.0,9.500.000 TL,
OĞLANANASINDA 880 m2 ARAZİ İÇİNDE 2 ADET 2+1 OLAN SATILIK BİNA,2,1,Soba,190.0,5.300.000 TL,
BAŞ-KALEDEN İŞLEKCADDE ÜZERİNDESATILIK KOMPLE BİNA4DAİRE 1İŞYERİ,5,1,Doğalgaz (Kombi),100.0,12.000.000 TL,
Urla Gülbahçe'de satılık bina,3,1,Klima,560.0,12.000.000 TL,
BUCA YEŞİLBAĞLAR MAHALLESİNDE SATILIK 3 KATLI MÜSTAKİL BİNA,3,1,Soba,128.0,4.500.000 TL,
KEMERALTI ANAFARTALAR CADDESİNDE SATILIK KIYMETLİ MÜLK,3,5 +,Yok,2.55,285.000.000 TL,
İKİ KATLI MÜSTAKİL BİNA YENİ YAPI,2,1,Doğalgaz (Kombi),230.0,6.300.000 TL,
konak merkezde satılık tarihi yapı turyaptan,2,2,Soba,60.0,2.200.000 TL,
Bornova Yunusemre'de Satılık Bina,4,1,Doğalgaz (Kombi),162.0,18.500.000 TL,
Eskiizmir Cad.Üzeri Zerek Petrolde 5 Daire 1 Dükkan Satılık Bina,6,1,Doğalgaz (Kombi),110.0,10.000.000 TL,
HAYY GAYRİMENKULDEN IŞIKKENT SANAYİDE KOMPLE SATILIK BİNA,4,1,Klima,1.05,31.000.000 TL,
BAŞ-KALE GAYRİMENKULDEN CADDE ÜZERİ 1 İŞYERİ 2 DAİRE KOMPLE BİNA,2,2,Soba,140.0,3.450.000 TL,
"BAŞ-KALEDEN AYLIK 55,000TL NET KİRA GETİRİLİ SATILIK KOMPLE BİNA",5,2,Doğalgaz (Kombi),180.0,13.500.000 TL,
BAŞ-KALEDEN ANA CADDE ÜZERİ 2 DAİRE 2 DÜKKAN MÜKEMMEL KONUM,3,2,Klima,130.0,5.950.000 TL,
5 katlı komple işyeri,5,1,Soba,250.0,4.100.000 TL,
CADDE ÜZERİNDE DÜKKAN PARASINA BİNA SATIYORUZ 7 AYRI TAPU,7,5 +,Yok,170.0,12.600.000 TL,
CEMİL HASEKİOĞLU'NDAN MUHTEŞEM KONUMDA ÜÇ DAİRE BİR DÜKKAN BİNA,4,1,Klima,165.0,7.000.000 TL,
İzmir Eşrefpaşa'da Deniz Manzaralı Satılık Bina,3,1,Yok,198.0,15.000.000 TL,
KONAK İSMETPAŞA MAH SATILIK BİNA,3,3,Klima,128.0,2.050.000 TL,
SAHİBİNDEN KOYUNDERE'DE SATILIK MÜSTAKİL 4 KATLI BİNA,4,1,Klima,184.0,6.000.000 TL,
Güzelbahçe'de Satılık Havuzlu 4 Katlı Bina,4,1,Doğalgaz (Kombi),500.0,30.000.000 TL,
Ferah Lüx Yok Açık Otopark Klima Satılık Doğa Manzaralı,3,1,Klima,120.0,3.450.000 TL,
MENEMEN ZAFER MAH. 176M2 ARSADA İÇİNDE 3 EV OLAN SATILIK BİNA,1,3,Soba,176.0,2.000.000 TL,
ADEM YAVUZ CADDESİNDE KOMPLE SATILIK BİNA,4,1,Doğalgaz (Kombi),90.0,2.850.000 TL,
KARALAR GYO DAN SATILIK,2,2,Doğalgaz (Kombi),660.0,18.000.000 TL,
KARABAĞLAR YEŞİLLİK CADDESİ 6 KATLI SATILIK 1300M2 KOMPLE BİNA,6,1,Klima,1.3,38.500.000 TL,
MENEMEN_GÖL PARK YAKINI 4_KATLI_KOMPLE SATILIK_BİNA,4,1,Doğalgaz (Kombi),218.0,9.500.000 TL,
Turyap Bornova'dan Çamkule'de 196 M2 Arsa İçinde 4 katlı Bina,4,1,Soba,465.0,6.225.000 TL,
BULUR' dan Konak İsmet Paşa Mah. Komple Satılık Bina,3,1,Klima,122.0,3.150.000 TL,
HAS EMLAK//İNÖNÜ MAH. SATILIK 1 DÖNÜM TARLA İÇİNDE MÜSTAKİL EV,2,1,Yerden Isıtma,250.0,12.000.000 TL,
ZAFERTEPE MAHALLESİNDE MERKEZİ KONUMDA KOMPLE YATIRIMLIK BİNA,4,1,Klima,370.0,9.500.000 TL,
ARDA 35 'DEN MENDERES GAZİPAŞA DA SATILIK BİNA,3,1,Doğalgaz (Kombi),270.0,7.200.000 TL,
BORNOVA MERK 2 DK MESAFEDE MALAZGİRT OKULU YAKINI MÜSTAKİL BİNA,2,1,Soba,200.0,3.750.000 TL,
AŞIKVEYSEL MAH. 2 KATLI KOMPLE SATILIK BİNA...,2,1,Klima,96.0,3.000.000 TL,
İZMİR BORNOVA MANAVKUYU DA KOMPLE SATILIK BİNA YETKİLİ OFİSTEN,3,2,Doğalgaz (Kombi),400.0,15.750.000 TL,
AVA EMLAK'TAN ALTINDAĞ YENER CADDESİ'NDE KOMPLE SATILIK BİNA,3,1,Klima,120.0,7.500.000 TL,
ATAKENT YALI MAHALLESİ ARASI KOMPLE SATILIK BİNA.,6,1,Doğalgaz (Kombi),90.0,12.250.000 TL,
İzmir Bornova Pınarbaşı Satılık Sıfır Bina,2,1,Yok,150.0,4.590.000 TL,
YEŞİLYURT DEVLET HASTANESİ YAKINI FULL EŞYALI KİRACILI SATILIK,4,2,Doğalgaz (Kombi),112.0,25.000.000 TL,
"ATATÜRK MAHALLESİNDE 4 KATLI, ÇATI DUBLEKSLİ AİLE APARTMANI",4,1,Doğalgaz (Kombi),196.0,8.500.000 TL,
BUCADA SIFIR PİLAN PIROJELİ İKİ KATLI MÜSTAKİL BİNA,2,1,Doğalgaz (Kombi),190.0,5.990.000 TL,
FIRAT MAH. KOMPLE SATILIK BEŞ KATLI BİNA...,5,1,Doğalgaz (Kombi),124.0,7.500.000 TL,
İZMİR FIRAT MAHALLESİNDE 6 DAİRE 2 DÜKKAN KİRA GETİRİSİ YÜKSEK,4,2,Soba,115.0,15.500.000 TL,
Kahramanlar Oteller ve Hastaneler Bolgesinde,1,1,Yok,90.0,7.500.000 TL,
"Urla Zeytinalanı İçinde 2 tane 2+1 Daire,2 Dükkan Komple Bina",2,2,Doğalgaz (Kombi),270.0,9.500.000 TL,
ESKİ İZMİR KİBAR SUPER KONUM,4,4,Doğalgaz (Merkezi),138.0,9.150.000 TL,
GÜRÇEŞME CADDESİ ÜZERİNDE 4 KATLI KOMPLE SATILIK BİNA,4,2,Soba,110.0,7.000.000 TL,
Bayraklı Manavkuyu Komple Satılık Bina,5,1,Klima,1.808,29.500.000 TL,
Turyap Bornova'dan Karacaoğlan'da Satılık Cad. Üstü 5 Katlı Bina,5,1,Yok,500.0,19.940.000 TL,
,,,,,,
ERA NİVA'DAN BUCA M.KEMAL MAHALLESİ'NDE SATILIK 3 KATLI BİNA,3,1,Doğalgaz (Kombi),80.0,3.500.000 TL,
KENT GAYRİMENKUL'DEN TİRE MEZKEZİNDE SATILIK BİNA,2,3,Soba,346.0,8.850.000 TL,
KAT MÜLİKYETLİ SATILIK KOMPLE BİNA - 3DAİRE 1DÜKKAN - AYRI TAPU,4,1,Soba,102.0,7.500.000 TL,
LOCATE'DEN BAYRAKLI TEPEKULE MAH. KOMPLE SATILIK 4 KATLI BİNA,4,1,Klima,360.0,4.000.000 TL,
ÇEŞME ILDIRDA DENİZE SIFIR ÖZEL LİMANI OLAN SATILIK VİLLA,2,3,Soba,3.5,152.000.000 TL,
BORNOVA İNÖNÜ MAH.KOMPLE SATILIK 4 KATLI BİNA,4,1,Klima,140.0,5.000.000 TL,
İZMİR/MENEMEN'DE SATILIK 3+1 DAİRE,6,2,Doğalgaz (Kombi),150.0,2.350.000 TL,
Çiğli'de 7 Daire Birden Satılık 3+1 ve 2+1 Daireler,4,2,Doğalgaz (Kombi),125.0,15.000.000 TL,
İçinde 2 katlı 2 ayrı daire ve arsa...her biri 3+1 daire !!,2,1,Klima,500.0,6.000.000 TL,
5428 M2 ZEYTİNLİK İÇİNDE BERGAMA BÖLCEKTE SATILIK MÜSTAKİL BİNA,2,2,Soba,95.0,9.750.000 TL,
Rafet Paşa' da Yatırımlık Komple Satılık Bina,4,4,Doğalgaz (Kombi),151.0,12.000.000 TL,
BORNOVA ATATÜRK İNİÖNÜ MAH SATILIK ÜÇ KATLI BİNA VE BİR DÜKKAN,3,1,Doğalgaz (Kombi),450.0,15.500.000 TL,
"YENİ mh.286m2 Arsa.ALANLI,BAHÇEL İ,DENİZman.D.gazlı MÜSTAKİL BİNA",3,1,Doğalgaz (Kombi),300.0,8.500.000 TL,
Ballıkuyu Kentsel Dönüşüm Bölgesinde Satılık Komple Bina,3,1,Yok,185.0,4.500.000 TL,
BORNOVA ÇAMDİBİNDE KOMPLE SATILIK BİNA,4,1,Klima,560.0,6.200.000 TL,
İZMİR KONAKTA SATILIK BİNA,2,2,Soba,289.0,2.500.000 TL,
MERT TEKİN'DEN ANA CADDE ÜZERİ FIRSAT 2 DÜKKAN 3 DAİRE 224 M2,2,2,Doğalgaz (Kombi),214.0,15.000.000 TL,
IZ ALKAN EMLAK TAN SATILIK BİNA,2,1,Kalorifer,280.0,4.750.000 TL,
Karabağlar Sanayide Satılık Komple Bina,3,1,Soba,143.0,5.280.000 TL,
GAZİEMİR EMREZ DE TOPLAM 4 KATLI FIRSAT BİNA TEK TAPU,4,1,Klima,262.0,5.750.000 TL,
Sahibinden Satılık Bina,2,2,Doğalgaz (Kombi),178.0,2.500.000 TL,
BORNOVA MTK SİTESİN DE 1000M2 SATILIK DEPO VE ÜRETİM TESİSİ,4,5 +,Klima,1.0,14.500.000 TL,
BİR DAİRE FİYATINA 3 KATLI SATILIK BİNA,3,1,Doğalgaz (Kombi),141.0,6.750.000 TL,
Buca Heykel Yakını Satılık Komple Bina,3,2,Klima,1.258,58.000.000 TL,
URLA İSKELE MAHALLESİNDE KOMPLE SATILIK BİNA,3,1,Doğalgaz (Kombi),214.0,35.000.000 TL,
ŞİRİNYER KOMPLE SATILIK 10 DAİRE TEK TEK TAPULU HEPSİ,5,2,Doğalgaz (Kombi),85.0,15.000.000 TL,
URLA MERKEZİ KONUM SATILIK BİNA (bir hafta geçerli indirim),3,1,Doğalgaz (Kombi),248.0,18.750.000 TL,
KAZIMDİRİK MAHALLESİN DE SATILIK KOMPLE BİNA,2,1,Yok,300.0,14.500.000 TL,
